<!ELEMENT dataset (Gruppen,BackgroundURL)>
<!ELEMENT Gruppen (Gruppe)*>
<!ELEMENT Gruppe (GruppeID,BereichID,GruppeName)*>
<!ELEMENT GruppeID (#PCDATA)>
<!ELEMENT BereichID (#PCDATA)>
<!ELEMENT GruppeName (#PCDATA)>
<!ELEMENT BackgroundURL (#PCDATA)>